Province,Temple
Ayutthaya,วัดวงษ์สวรรค์
Ayutthaya,วัดวชิรธรรมาราม
Ayutthaya,วัดวรนายกรังสรรค์เจติยบรรพตาราม
Ayutthaya,วัดวรเชษฐ์
Ayutthaya,วัดวรโพธิ์
Ayutthaya,วัดวัง
Ayutthaya,วัดวังชะโด
Ayutthaya,วัดวังแดงเหนือ
Ayutthaya,วัดวังแดงใต้
Ayutthaya,วัดวิมลสุนทร
Ayutthaya,วัดวิเวกวายุพัด
Ayutthaya,วัดศรีประชา
Ayutthaya,วัดศรีภวังค์
Ayutthaya,วัดศรีโพธิ์
Ayutthaya,วัดศักดิ์
Ayutthaya,วัดศาลาปูนวรวิหาร
Ayutthaya,วัดศาลาลอย
Ayutthaya,วัดศาลาแดง
Ayutthaya,วัดศิริสุขาราม
Ayutthaya,วัดศิวาราม
Ayutthaya,วัดสง่างาม
Ayutthaya,วัดสฎางค์
Ayutthaya,วัดสนามทอง
Ayutthaya,วัดสนามไชย
Ayutthaya,วัดสบสวรรค์
Ayutthaya,วัดสมณโกฏฐาราม
Ayutthaya,วัดสระเกษ
Ayutthaya,วัดสว่างอารมณ์
Ayutthaya,วัดสหกรณ์ธรรมนิมิต
Ayutthaya,วัดสะตือ
Ayutthaya,วัดสะแก
Ayutthaya,วัดสันติการาม
Ayutthaya,วัดสันติธรรมาราม
Ayutthaya,วัดสันติวนาราม
Ayutthaya,วัดสามกอ
Ayutthaya,วัดสามตุ่ม
Ayutthaya,วัดสามบัณฑิต
Ayutthaya,วัดสามวิหาร
Ayutthaya,วัดสามเพลง
Ayutthaya,วัดสามเรือน
Ayutthaya,วัดสามไถ
Ayutthaya,วัดสำพะเนียง
Ayutthaya,วัดสำมะกัน
Ayutthaya,วัดสำเภาล่ม
Ayutthaya,วัดสิงห์สุทธาวาส
Ayutthaya,วัดสีกุก
Ayutthaya,วัดสีจำปา
Ayutthaya,วัดสุคนธาราม
Ayutthaya,วัดสุคันธาราม
Ayutthaya,วัดสุทธาวาส
Ayutthaya,วัดสุทธิรุจิราราม
Ayutthaya,วัดสุธาโภชน์
Ayutthaya,วัดสุนทราราม
Ayutthaya,วัดสุวรรณดารารามราชวรวิหาร
Ayutthaya,วัดสุวรรณธรรมาราม
Ayutthaya,วัดสุวรรณเจดีย์
Ayutthaya,วัดสุเมธ
Ayutthaya,วัดหงษ์
Ayutthaya,วัดหนองกลาง
Ayutthaya,วัดหนองนาง
Ayutthaya,วัดหนองนางเก่า
Ayutthaya,วัดหนองน้ำส้ม
Ayutthaya,วัดหนองบัว
Ayutthaya,วัดหนองลำเจียก
Ayutthaya,วัดหนองเครือบุญ
Ayutthaya,วัดหนองเป้า
Ayutthaya,วัดหนองแห้ว
Ayutthaya,วัดหนองโคก
Ayutthaya,วัดหนองโสน
Ayutthaya,วัดหนองไม้ซุง
Ayutthaya,วัดหน้าต่างนอก
Ayutthaya,วัดหน้าต่างใน
Ayutthaya,วัดหน้าโคก
Ayutthaya,วัดหลวงพ่อเขียว
Ayutthaya,วัดหลักชัย
Ayutthaya,วัดหันตรา
Ayutthaya,วัดหันสัง
Ayutthaya,วัดหัวคุ้ง
Ayutthaya,วัดหัวหิน
Ayutthaya,วัดหัวเวียง
Ayutthaya,วัดห้วยจรเข้
Ayutthaya,วัดอนุกุญชราราม
Ayutthaya,วัดอมฤตสิทธาราม
Ayutthaya,วัดอัมพวา
Ayutthaya,วัดอินกัลยา
Ayutthaya,วัดอินทอารี
Ayutthaya,วัดอินทาราม
Ayutthaya,วัดอุทการาม
Ayutthaya,วัดอุทัย
Ayutthaya,วัดอุโลม
Ayutthaya,วัดอู่สำเภา
Ayutthaya,วัดอโยธยา
Ayutthaya,วัดอ่างทอง
Ayutthaya,วัดเกตุ
Ayutthaya,วัดเกาะราษฎร์ศรัทธาธรรม
Ayutthaya,วัดเกาะเลิ่ง
Ayutthaya,วัดเกาะแก้ว
Ayutthaya,วัดเกาะแก้วเกษฎาราม
Ayutthaya,วัดเก้าห้อง
Ayutthaya,วัดเขาดิน
Ayutthaya,วัดเขียนลาย
Ayutthaya,วัดเจดีย์แดง
Ayutthaya,วัดเจริญธรรม
Ayutthaya,วัดเจ้าปลุก
Ayutthaya,วัดเจ้าเจ็ดนอก
Ayutthaya,วัดเจ้าเจ็ดใน
Ayutthaya,วัดเจ้าแปดทรงไตรย์
Ayutthaya,วัดเชิงท่า
Ayutthaya,วัดเชิงเลน
Ayutthaya,วัดเชียงรากน้อย
Ayutthaya,วัดเทพกุญชร
Ayutthaya,วัดเทพคันธาราม
Ayutthaya,วัดเทพจันทร์ลอย
Ayutthaya,วัดเทพธาราราม
Ayutthaya,วัดเทพมงคล
Ayutthaya,วัดเทพสนทวารี
Ayutthaya,วัดเทพสุวรรณ
Ayutthaya,วัดเทพอุปการาม
Ayutthaya,วัดเปรมประชากร
Ayutthaya,วัดเรือแข่ง
Ayutthaya,วัดเวฬุวัน
Ayutthaya,วัดเวียง
Ayutthaya,วัดเศวตศิลาราม
Ayutthaya,วัดเสด็จ
Ayutthaya,วัดเสนา
Ayutthaya,วัดเสนาสนารามราชวรวิหาร
Ayutthaya,วัดเสาธง
Ayutthaya,วัดเสาธงเก่า
Ayutthaya,วัดเสาธงใหม่
Ayutthaya,วัดแก้ว
Ayutthaya,วัดแก้วตา
Ayutthaya,วัดแก้วฟ้า
Ayutthaya,วัดแก้วสุวรรณ
Ayutthaya,วัดแค
Ayutthaya,วัดแคท่าเรือ
Ayutthaya,วัดแจ้ง
Ayutthaya,วัดแดง
Ayutthaya,วัดแม่นางปลื้ม
Ayutthaya,วัดโกโรโกโส
Ayutthaya,วัดโขดเขมาราม
Ayutthaya,วัดโคก
Ayutthaya,วัดโคกกรวด
Ayutthaya,วัดโคกกลาง
Ayutthaya,วัดโคกจินดาราม
Ayutthaya,วัดโคกจุฬา
Ayutthaya,วัดโคกช้าง
Ayutthaya,วัดโคกทอง
Ayutthaya,วัดโคกมะยม
Ayutthaya,วัดโคกม่วง
Ayutthaya,วัดโคกสังข์
Ayutthaya,วัดโคกหิรัญ
Ayutthaya,วัดโคกเสือ
Ayutthaya,วัดโคกโพธิ์
Ayutthaya,วัดโตนด
Ayutthaya,วัดโตนดเตี้ย
Ayutthaya,วัดโบสถ์
Ayutthaya,วัดโบสถ์พัทธสีมา
Ayutthaya,วัดโบสถ์สมพรชัย
Ayutthaya,วัดโบสถ์อินทราราม
Ayutthaya,วัดโปรดสัตว์
Ayutthaya,วัดโพธิผักไห่
Ayutthaya,วัดโพธิ์
Ayutthaya,วัดโพธิ์ทอง
Ayutthaya,วัดโพธิ์ทองหนองจิก
Ayutthaya,วัดโพธิ์ประสิทธิ์
Ayutthaya,วัดโพธิ์ลอย
Ayutthaya,วัดโพธิ์ลำแพน
Ayutthaya,วัดโพธิ์สาวหาญ
Ayutthaya,วัดโพธิ์หอม
Ayutthaya,วัดโพธิ์เผือก
Ayutthaya,วัดโพธิ์เอน
Ayutthaya,วัดโพธิ์แตงเหนือ
Ayutthaya,วัดโพธิ์แตงใต้
Ayutthaya,วัดโพธิ์ไทร
Ayutthaya,วัดโรงนา
Ayutthaya,วัดโสภณเจติการาม
Ayutthaya,วัดใบบัว
Ayutthaya,วัดใหญ่ชัยมงคล
Ayutthaya,วัดใหญ่เทพนิมิตร
Ayutthaya,วัดใหม่
Ayutthaya,วัดใหม่ชุมพล
Ayutthaya,วัดใหม่ต้านทาน
Ayutthaya,วัดใหม่ปากบาง
Ayutthaya,วัดใหม่สองห้อง
Ayutthaya,วัดใหม่หนองคต
Ayutthaya,วัดไก่
Ayutthaya,วัดไก่จ้น
Ayutthaya,วัดไก่เตี้ย
Ayutthaya,วัดไชย
Ayutthaya,วัดไชยภูมิ
Ayutthaya,วัดไทรงาม
Ayutthaya,วัดไทรน้อย
Ayutthaya,วัดไทรโสภณ
Ayutthaya,วัดไผ่ล้อม
Ayutthaya,วัดไผ่โสมนรินทร์
Ayutthaya,วัดไพฑูริย์ถนิมาราม
Ayutthaya,วัดไม้ตราสมาชิการาม
Ayutthaya,วัดไม้รวก
