Province,Temple
prayao,วัดเมืองอิงหลวง
prayao,วัดร่องปอ
prayao,วัดบ้านไร่
prayao,วัดห้วยหม้อ
prayao,วัดพระธาตุแจ่โห้ว
prayao,วัดท่าจำปี
prayao,วัดต๊ำน้ำล้อม
prayao,วัดศรีดอนชัย 
prayao,วัดแช่แห้ง
prayao,วัดหย่วน
prayao,วัดต๋อมใต้
prayao,วัดสันกว๊าน
prayao,วัดโพธาราม
prayao,วัดร่องค้อม
prayao,วัดวังบง
prayao,วัดกองแล
prayao,วัดน้ำปุก
prayao,วัดกิ่วแก้ว
prayao,วัดสบสา
prayao,วัดทุ่งหลวง
prayao,วัดศรีดอนตัน
prayao,วัดป่าแฝกเหนือ
prayao,วัดหัวนา
prayao,วัดทุ่งเย็น
prayao,วัดเนินสมบูรณ์วนาราม
prayao,วัดสีพรม
prayao,วัดใหม่ดอนมูล
prayao,วัดต๊ำกลาง
prayao,วัดใหม่ต้นฝาง
prayao,วัดห้วยเคียนเหนือ
prayao,วัดดอนมูล
prayao,วัดพวงพยอม
prayao,วัดไชยพรม
prayao,วัดสร้อยศรี
prayao,วัดบ้านซ่อน
prayao,วัดปันเจิง
prayao,วัดทุ่งต้นศรี
prayao,วัดบุญโยชน์
prayao,วัดก๊อน้อย
prayao,วัดร่องส้าน
prayao,วัดทุ่งติ้ว
prayao,วัดท่าฟ้าเหนือ
prayao,วัดพระธาตุดอยน้อย
prayao,วัดราษฎร์บำรุง
prayao,วัดประชาสามัคคี 
prayao,วัดจนหลวง
prayao,วัดศรีสำราญ
prayao,วัดหนองสระ
prayao,วัดป่ากล้วยงาม
prayao,วัดหล่ายทุ่ง
prayao,วัดดอนไชย
prayao,วัดดงบุญนาค
prayao,วัดดอยกู่ไก่แก้ว 
prayao,วัดสันทราย
prayao,วัดป่าลานคำ
prayao,วัดผาลาด
prayao,วัดปง
prayao,วัดไชยพฤกษ์
prayao,วัดศรีเกิด
prayao,วัดสระใต้
prayao,วัดสักลอ
prayao,วัดสันป่าเหียง
prayao,วัดแม่กาไร่
prayao,วัดปทุมทอง
prayao,วัดป่าม่วง
prayao,วัดพระธาตุขิงแกง
prayao,วัดห้วยงิ้ว
prayao,วัดงุ้นพัฒนา
prayao,วัดเนินสามัคคี
prayao,วัดม่วง
prayao,วัดบุญเรือง
prayao,วัดพระธาตุแสงแก้วมงคล
prayao,วัดภูเงิน
prayao,วัดน้ำแป้งพนาราม
prayao,วัดพระธาตุดอยจุก
prayao,วัดวังถ้ำ
prayao,วัดร้องใหม่
prayao,วัดแสนเมืองมา
prayao,วัดหงส์หิน
prayao,วัดหม้อแกงทอง
prayao,วัดนาเจริญ
prayao,วัดผาช้างมูบ
prayao,วัดทุ่งรวงทอง
prayao,วัดน้ำมิน
prayao,วัดดาวเรือง
prayao,วัดศรีจอมเรือง
prayao,วัดท่าฟ้าใต้
prayao,วัดทุ่มท่า
prayao,วัดบัวหล่าย 
prayao,วัดสงเคราะห์ราษฎร์
prayao,วัดศรีมงคล
prayao,วัดฝายแก้ว
prayao,วัดไชยอาวาส
prayao,วัดอารามป่าน้อย
prayao,วัดทัศนาราม
prayao,วัดศรีสุพรรณ
prayao,วัดสุจิตธรรม 
prayao,วัดบุญชุม
prayao,วัดแม่พริกเทพนิมิตร
prayao,วัดดอนเรือง
prayao,วัดวังเค็มเก่า
prayao,วัดสันหมื่นแก้ว
prayao,วัดห้วยสิงห์
prayao,วัดปางป้อม
prayao,วัดสันป่าม่วง
prayao,วัดควรดง
prayao,วัดเทพวราราม
prayao,วัดต๊ำพระแล
prayao,วัดหลวง
prayao,วัดดงสุวรรณ
prayao,วัดรัตนวนาราม
prayao,วัดพระธาตุภูขวาง
prayao,วัดบ้านหลวง
prayao,วัดแม่ใส
prayao,วัดห้วยทรายขาว
prayao,วัดหนอง
prayao,วัดฝายกวาง
prayao,วัดสว่างอารมณ์
prayao,วัดทุ่งหนอง
prayao,วัดแม่กาหลวง
prayao,วัดห้วยสา
prayao,วัดใคร้ป่าคา
prayao,วัดสันป่าถ่อน
prayao,วัดปัวชัย
prayao,วัดแม่ต๋ำ
prayao,วัดจำบอน
prayao,วัดบ้านโป่ง
prayao,วัดเก้าเงา
prayao,วัดศรีบุญเรือง
prayao,วัดเกษมสันติวนาราม
prayao,วัดป่าคาใหม่
prayao,วัดต๊ำเหล่า
prayao,วัดสุขเกษม
prayao,วัดมงคลคีรี
prayao,วัดสบบง
prayao,วัดศรีดอนมูล
prayao,วัดบ่อแฮ้ว
prayao,วัดกอก
prayao,วัดบ้านงิ้ว
prayao,วัดสันป่าสัก
prayao,วัดห้วยทรายเลื่อน
prayao,วัดห้วยข้าวก่ำ
prayao,วัดสันช้างหิน
prayao,วัดศรีล้อม
prayao,วัดสะพานดำ
prayao,วัดสถิตย์ธัมมาราม
prayao,วัดค่าไพบูลย์
prayao,วัดป่าแฝกใต้
prayao,วัดเมืองชุม
prayao,วัดห้วยบง
prayao,วัดร่องห้า
prayao,วัดพระแก้ว
prayao,วัดแผ่นดินทอง
prayao,วัดภูมินทร์
prayao,วัดบุญนาค
prayao,วัดหนองบัวเงิน
prayao,วัดปัวแหลง
prayao,วัดป่าตุ้ม
prayao,วัดเชียงยืน
prayao,วัดทองแย้ม
prayao,วัดแม่วังช้าง
prayao,วัดไชยมงคล
prayao,วัดขุนต๊ำ
prayao,วัดสถาน
prayao,วัดใหม่หลวง
prayao,วัดแท่นคำ
prayao,วัดเชียงทอง
prayao,วัดแม่ทะลาย
prayao,วัดบ้านปิน
prayao,วัดสันต้นผึ้ง
prayao,วัดม่อนป่าสัก
prayao,วัดทุ่งแขม
prayao,วัดพระธาตุบุญนาค
prayao,วัดน้ำจุน
prayao,วัดศรีชุม
prayao,วัดร่องป่าเปา
prayao,วัดลี
prayao,วัดต๋อมดง
prayao,วัดร่องไผ่
prayao,วัดดอยอิสาน
prayao,วัดปางมดแดง
prayao,วัดหลวงราชสัณฐาน
prayao,วัดบุบผาราม
prayao,วัดปัจฉิมวาส
prayao,วัดทุ่งมอก
prayao,วัดป่าแขม
prayao,วัดต๋อมกลาง
prayao,วัดป่าสัก
prayao,วัดพระธาตุจอมศีล
prayao,วัดแวนวัฒนา
prayao,วัดแดนเมือง
prayao,วัดร่องชมภู
prayao,วัดก๊อซาว
prayao,วัดร้องเชียงแรง
prayao,วัดพระนั่งดิน
prayao,วัดป่าสักคำ
prayao,วัดป่าแฝกกลาง
prayao,วัดสันสลี
prayao,วัดพระธาตุภูซาง
prayao,วัดนันตาราม 
prayao,วัดร่องย้าง
prayao,วัดแม่จั๊วะ
prayao,วัดสีมา
prayao,วัดป่าแดงบุญนาค
prayao,วัดอิงโค้ง 
prayao,วัดบ้านแม่ปืม
prayao,วัดบ้านเลี้ยว
prayao,วัดบ้านทุ่ง
prayao,วัดผาตั้ง
prayao,วัดบ้านบัว
prayao,วัดป่าฝาง
prayao,วัดทุ่งหล่ม
prayao,วัดปัวใหม่
prayao,วัดตุ่นใต้
prayao,วัดแม่สุก
prayao,วัดนาปรัง
prayao,วัดดอนเหล็ก
prayao,วัดหล่าย
prayao,วัดธรรมมิการาม
prayao,วัดสังคหะราษฎร์
prayao,วัดตาลถ้อย
prayao,วัดม่วงชุม
prayao,วัดเชียงบาน
prayao,วัดเชียงหมั้น
prayao,วัดบุญฮอม
prayao,วัดดงอินตา
prayao,วัดศรีปันต้น
prayao,วัดต๊ำม่อน 
prayao,วัดค้างหงษ์
prayao,วัดหนองลาว
prayao,วัดพระธาตุดอยหยวก
pattani,วัดตานีนรสโมสร
pattani,วัดมุจลินทวาปีวิหาร
pattani,วัดภมรคติวัน
pattani,วัดโพธาราม
pattani,วัดปลักปรือ
pattani,วัดควนน้อย
pattani,วัดบุพพนิมิตร
pattani,วัดป่าสวย
pattani,วัดทุ่งข่อย
pattani,วัดช้างให้ราษฎร์บูรณาราม
pattani,วัดหนองครก
pattani,วัดคลองช้าง
pattani,วัดมะเดื่อทอง
pattani,วัดศรีมหาโพธิ์
pattani,วัดทรายขาว
pattani,วัดนิคมควนเปล
pattani,วัดโรงวาส
pattani,วัดพลานุภาพ
pattani,วัดอรัญวาสิการาม
pattani,วัดนาประดู่
pattani,วัดนิคมสถิตย์
pattani,วัดปุราณประดิษฐ์
pattani,วัดสุนทรวารี
pattani,วัดธนาภิมุข
pattani,วัดบ้านไร่
pattani,วัดบันลือคชาวาส
pattani,วัดปุหรน
pattani,วัดมะปรางมัน
pattani,วัดมะกรูด
pattani,วัดโมลีนิมิต
pattani,วัดหน้าเกตุ
pattani,วัดหัวควน
pattani,วัดควนนอก
pattani,วัดควนใน
pattani,วัดญาโณทัย
pattani,วัดมหิงษาราม
pattani,วัดดอนกลาง
pattani,วัดดอนตะวันออก
pattani,วัดดิษฐาวาส
pattani,วัดโพธาราม
pattani,วัดเทพนิมิตร
pattani,วัดศรีสุดาจันทร์
pattani,วัดประจันตคาม
pattani,วัดพรหมประสิทธิ์
pattani,วัดสำเภาเชย
pattani,วัดสาละวัน
pattani,วัดหงสาราม
pattani,วัดประเวศน์ภูผา
pattani,วัดมาลีนิเวศน์
pattani,วัดขจรประชาราม
pattani,วัดหลักเมือง
pattani,วัดบ้านดี
pattani,วัดนิกรชนาราม
pattani,วัดสันติการาม
pattani,วัดนพวงศาราม
pattani,วัดสารวัน
pattani,วัดโชติรส
pattani,วัดมหันตคาม
pattani,วัดไม้แก่น
pattani,วัดโคกหญ้าคา
pattani,วัดอัมพวนาราม
pattani,วัดคามวาสิการาม
pattani,วัดมหิงษ์สุวรรณนิมิต
pattani,วัดป่าศรี
pattani,วัดกุสาวดี
pattani,วัดปิยาราม
pattani,วัดตะเคียนทอง
pattani,วัดบูรพาราม
pattani,วัดมัชฌิมาวาส
pattani,วัดมะปริงวารีราม
pattani,วัดเลียบ
pattani,วัดวิมลวัฒนาราม
pattani,วัดปทุมวารี
pattani,วัดทุ่งคล้า
pattani,วัดถัมภาวาส
pattani,วัดจุฬามณี
pattani,วัดโบกขรณี
pattani,วัดสุทธิกาวาส
pattani,วัดสุวรรณากร
pattani,วัดสถิตย์ชลธาร
pattani,วัดสุนันทาราม
pattani,วัดยานิการาม
Ayutthaya,วัดกกแก้วบูรพา
Ayutthaya,วัดกระแซง
Ayutthaya,วัดกระโจมทอง
Ayutthaya,วัดกระโดงทอง
Ayutthaya,วัดกลาง
Ayutthaya,วัดกลางขุย
Ayutthaya,วัดกลางคลองวัฒนาราม
Ayutthaya,วัดกลางคลองสระบัว
Ayutthaya,วัดกลางทุ่ง
Ayutthaya,วัดกลางปากกราน
Ayutthaya,วัดกลางรามัญ
Ayutthaya,วัดกลางเกาะระกำ
Ayutthaya,วัดกล้วย
Ayutthaya,วัดกษัตราธิราชวรวิหาร
Ayutthaya,วัดกอไผ่
Ayutthaya,วัดกะสังข์
Ayutthaya,วัดกำแพง
Ayutthaya,วัดกำแพงแก้ว
Ayutthaya,วัดกุฎีกรุ
Ayutthaya,วัดกุฎีทอง
Ayutthaya,วัดกุฎีประสิทธิ์
Ayutthaya,วัดกุฎีลาย
Ayutthaya,วัดกุ่มแต้
Ayutthaya,วัดขนอน
Ayutthaya,วัดขนอนเหนือ
Ayutthaya,วัดขนอนใต้
Ayutthaya,วัดขุนจ่าธรรมาราม
Ayutthaya,วัดขุนทราย
Ayutthaya,วัดขุนทิพย์
Ayutthaya,วัดขุนพรหม
Ayutthaya,วัดขุมแก้ว
Ayutthaya,วัดคงษาสุทธาราม
Ayutthaya,วัดครุฑธาราม
Ayutthaya,วัดคลองตัน
Ayutthaya,วัดคลองน้ำชา
Ayutthaya,วัดคลองบุญ
Ayutthaya,วัดคลองพุทรา
Ayutthaya,วัดคานหาม
Ayutthaya,วัดคู้สลอดวุฒิโสภณ
Ayutthaya,วัดค่าย
Ayutthaya,วัดจงกลณี
Ayutthaya,วัดจรเข้ไล่
Ayutthaya,วัดจอมเกษ
Ayutthaya,วัดจักราช
Ayutthaya,วัดจันทร์
Ayutthaya,วัดจันทร์ประเทศ
Ayutthaya,วัดจันทาราม
Ayutthaya,วัดจำปา
Ayutthaya,วัดจุฬามณี
Ayutthaya,วัดฉัตรทองดำริธรรม
Ayutthaya,วัดชายนา
Ayutthaya,วัดชีปะขาว
Ayutthaya,วัดชีโพน
Ayutthaya,วัดชุมพล
Ayutthaya,วัดชุมพลนิกายารามราชวรวิหาร
Ayutthaya,วัดชุมแสง
Ayutthaya,วัดชูจิตธรรมาราม
Ayutthaya,วัดช่างทอง
Ayutthaya,วัดช่างเหล็ก
Ayutthaya,วัดช้าง
Ayutthaya,วัดช้างใหญ่
Ayutthaya,วัดซึก
Ayutthaya,วัดญาณเสน
Ayutthaya,วัดดงหวาย
Ayutthaya,วัดดอกไม้
Ayutthaya,วัดดอนกลาง
Ayutthaya,วัดดอนพัฒนาราม
Ayutthaya,วัดดอนพุทรา
Ayutthaya,วัดดอนลาน
Ayutthaya,วัดดอนหญ้านาง
Ayutthaya,วัดดาวคะนอง
Ayutthaya,วัดดุสิดาราม
Ayutthaya,วัดตรีพาราสีมาเขต
Ayutthaya,วัดตลาด
Ayutthaya,วัดตลาดเกรียบ
Ayutthaya,วัดตองปุ
Ayutthaya,วัดตะกู
Ayutthaya,วัดตะเคียน
Ayutthaya,วัดตะโก
Ayutthaya,วัดตะโหนด
Ayutthaya,วัดตาลานเหนือ
Ayutthaya,วัดตาลานใต้
Ayutthaya,วัดตาลเอน
Ayutthaya,วัดตำหนัก
Ayutthaya,วัดตำหนักพระเจ้าทรงธรรม
Ayutthaya,วัดตึก
Ayutthaya,วัดตึกคชหิรัญศรัทธาราม
Ayutthaya,วัดตูม
Ayutthaya,วัดต้นสะตือ
Ayutthaya,วัดถลุงเหล็ก
Ayutthaya,วัดทรงกุศล
Ayutthaya,วัดทอง
Ayutthaya,วัดทองจันทริการาม
Ayutthaya,วัดทองทรงธรรม
Ayutthaya,วัดทองบ่อ
Ayutthaya,วัดทางกลาง
Ayutthaya,วัดทางยาว
Ayutthaya,วัดทางหลวง
Ayutthaya,วัดทำเลไทย
Ayutthaya,วัดทุ่งชาน
Ayutthaya,วัดทุ่งมล
Ayutthaya,วัดทุ่งศรีโพธิ์
Ayutthaya,วัดท่า
Ayutthaya,วัดท่าการ้อง
Ayutthaya,วัดท่าซุงทักษิณาราม
Ayutthaya,วัดท่าดินแดง
Ayutthaya,วัดท่าตอ
Ayutthaya,วัดท่าสุทธาวาส
Ayutthaya,วัดท่าโขลง วัดตูม
Ayutthaya,วัดท้าวอู่ทอง
Ayutthaya,วัดธรรมจริยา
Ayutthaya,วัดธรรมจักร์
Ayutthaya,วัดธรรมนาวา
Ayutthaya,วัดธรรมนิยม
Ayutthaya,วัดธรรมรส
Ayutthaya,วัดธรรมสินธุ์โสภา
Ayutthaya,วัดธรรมาราม
Ayutthaya,วัดธรรมิกราช
Ayutthaya,วัดธรรมโชติการาม
Ayutthaya,วัดนกกระจาบ
Ayutthaya,วัดนครหลวง
Ayutthaya,วัดนครโปรดสัตว์
Ayutthaya,วัดนนทรีย์
Ayutthaya,วัดนาค
Ayutthaya,วัดนาคสโมสร
Ayutthaya,วัดนาคู 
Ayutthaya,วัดนางกุย
Ayutthaya,วัดนางคุ่ม
Ayutthaya,วัดนางชี
Ayutthaya,วัดนาอุ่น
Ayutthaya,วัดนิเวศธรรมประวัติราชวรวิหาร
Ayutthaya,วัดน้อมประชาสรรค์
Ayutthaya,วัดน้อย
Ayutthaya,วัดน้ำเต้า
Ayutthaya,วัดบรมวงศ์อิศรวรารามวรวิหาร
Ayutthaya,วัดบันลือธรรม
Ayutthaya,วัดบันได
Ayutthaya,วัดบันไดช้าง
Ayutthaya,วัดบัวงาม
Ayutthaya,วัดบางกะจะ
Ayutthaya,วัดบางกะทิง
Ayutthaya,วัดบางคล้า
Ayutthaya,วัดบางซ้ายนอก
Ayutthaya,วัดบางซ้ายใน
Ayutthaya,วัดบางนมโค
Ayutthaya,วัดบางบาล
Ayutthaya,วัดบางปลาหมอ
Ayutthaya,วัดบางม่วง
Ayutthaya,วัดบางยี่โท
Ayutthaya,วัดบางระกำ
Ayutthaya,วัดบางสงบ
Ayutthaya,วัดบางเคียนวิเชียรฉาย
Ayutthaya,วัดบางเดื่อ
Ayutthaya,วัดบางเพลิง
Ayutthaya,วัดบางแขยง
Ayutthaya,วัดบางไทร
Ayutthaya,วัดบำรุงธรรม
Ayutthaya,วัดบึง
Ayutthaya,วัดบึงลัฎฐิวัน
Ayutthaya,วัดบุญกันนาวาส
Ayutthaya,วัดบ้านกลิ้ง
Ayutthaya,วัดบ้านขวาง
Ayutthaya,วัดบ้านชุ้ง
Ayutthaya,วัดบ้านช้าง
Ayutthaya,วัดบ้านดาบ
Ayutthaya,วัดบ้านพลับ
Ayutthaya,วัดบ้านพาด
Ayutthaya,วัดบ้านพาสน์
Ayutthaya,วัดบ้านม้า
Ayutthaya,วัดบ้านราม
Ayutthaya,วัดบ้านร่อม
Ayutthaya,วัดบ้านสร้าง
Ayutthaya,วัดบ้านหว้า
Ayutthaya,วัดบ้านหีบ
Ayutthaya,วัดบ้านอ้อ
Ayutthaya,วัดบ้านเลนสระกระจับ
Ayutthaya,วัดบ้านแค
Ayutthaya,วัดบ้านแจ้ง
Ayutthaya,วัดบ้านแดง
Ayutthaya,วัดบ้านแถว
Ayutthaya,วัดบ้านแป้ง
Ayutthaya,วัดบ้านแพน
Ayutthaya,วัดปทุมวัน
Ayutthaya,วัดประดู่ตะบอง
Ayutthaya,วัดประดู่ทรงธรรม
Ayutthaya,วัดประดู่โลกเชฎฐ์
Ayutthaya,วัดประมุง
Ayutthaya,วัดประสาท
Ayutthaya,วัดปราสาททอง
Ayutthaya,วัดปรีดาราม
Ayutthaya,วัดปากกราน
Ayutthaya,วัดปากคลอง
Ayutthaya,วัดปากน้ำ
Ayutthaya,วัดปิ่นแก้ว
Ayutthaya,วัดป่าคา
Ayutthaya,วัดป่าศรีถาวรอยุธยา
Ayutthaya,วัดป่าอารยวังสาราม
Ayutthaya,วัดป่าโค
Ayutthaya,วัดป้อมรามัญ
Ayutthaya,วัดป้อมแก้วประโชติวิทยาภรณ์
Ayutthaya,วัดป้อมใหญ่
Ayutthaya,วัดผดุงธรรม
Ayutthaya,วัดผึ่งแดด
Ayutthaya,วัดพนมยงค์
Ayutthaya,วัดพนัญเชิงวรวิหาร
Ayutthaya,วัดพยอม
Ayutthaya,วัดพยาญาติ
Ayutthaya,วัดพรหมนิมิต
Ayutthaya,วัดพรหมนิวาสวรวิหาร
Ayutthaya,วัดพระขาว
Ayutthaya,วัดพระงาม
Ayutthaya,วัดพระญาติการาม
Ayutthaya,วัดพระธาตุศรีรัตนาราม
Ayutthaya,วัดพระนอน
Ayutthaya,วัดพระศรีสรรเพชญ์
Ayutthaya,วัดพระเมรุราชิการามวรวิหาร
Ayutthaya,วัดพระแก้ว
Ayutthaya,วัดพรานนก
Ayutthaya,วัดพร้าวโสภณาราม
Ayutthaya,วัดพิกุลโสคันธ์
Ayutthaya,วัดพิชัยสงคราม
Ayutthaya,วัดพุฒาวาส
Ayutthaya,วัดพุทไธศวรรย์
Ayutthaya,วัดภาชี
Ayutthaya,วัดภูเขาทอง
Ayutthaya,วัดมณฑป
Ayutthaya,วัดมณฑลประสิทธิ์
Ayutthaya,วัดมฤคทายวัน
Ayutthaya,วัดมหาจุฬาลงกรณราชูทิศ บ่อตาโล่
Ayutthaya,วัดมหาพล
Ayutthaya,วัดมหาโลก
Ayutthaya,วัดมะขามโพลง
Ayutthaya,วัดมาบพระจันทร์
Ayutthaya,วัดมาบโพธิ์
Ayutthaya,วัดมารวิชัย
Ayutthaya,วัดมเหยงคณ์
Ayutthaya,วัดมเหยงค์
Ayutthaya,วัดม่วง
Ayutthaya,วัดม่วงหวาน
Ayutthaya,วัดยม
Ayutthaya,วัดยมนาตามธรรม
Ayutthaya,วัดยวด
Ayutthaya,วัดยางนม
Ayutthaya,วัดย่านอ่างทอง
Ayutthaya,วัดระโสม
Ayutthaya,วัดรัตนชัย
Ayutthaya,วัดรางจระเข้
Ayutthaya,วัดราชบรรทม
Ayutthaya,วัดราชบัวขาว
Ayutthaya,วัดราชประดิษฐาน
Ayutthaya,วัดรามพงศาวาส
Ayutthaya,วัดราษฎรบรรจง
Ayutthaya,วัดราษฎร์นิยม
Ayutthaya,วัดราษฎร์บำรุง
Ayutthaya,วัดราษฎร์บำเพ็ญ
Ayutthaya,วัดราษฎร์ปุณณาราม
Ayutthaya,วัดราษฎร์ศรัทธาธรรม
Ayutthaya,วัดร่มโพธิ์
Ayutthaya,วัดร้อยไร่
Ayutthaya,วัดฤๅไชย
Ayutthaya,วัดลอดช่อง
Ayutthaya,วัดละมุด
Ayutthaya,วัดลาดชะโด
Ayutthaya,วัดลาดชิด
Ayutthaya,วัดลาดทราย
Ayutthaya,วัดลาดบัวหลวง
Ayutthaya,วัดลาดประทุมคงคาราม
Ayutthaya,วัดลาดระโหง
Ayutthaya,วัดลาย
Ayutthaya,วัดลำตะเคียน
Ayutthaya,วัดลำบัว
Ayutthaya,วัดลำพระยาราษฎร์เจริญธรรม
Ayutthaya,วัดลุ่ม
Ayutthaya,วัดวงษ์ฆ้อง
